{
  "version": "1.0",
  "entities": [],
  "events": [
    {
      "id": "event-unsafe-upgrade",
      "extensions": {
        "history": {
          "time": {
            "year": 2026,
            "futureTemporalMeaning": {
              "opaque": true
            }
          }
        }
      }
    }
  ],
  "relations": [],
  "extensions": {
    "draft.github.sukoyaka-dopeness.specification": {
      "specVersion": "0.1.0",
      "uses": [
        {
          "extension": "history",
          "version": "1.0.0"
        }
      ]
    }
  }
}
