{
  "version": "1.0",
  "entities": [],
  "events": [
    {
      "id": "event-1",
      "name": "Exact declaration example",
      "extensions": {
        "history": {
          "time": {
            "year": 2026,
            "month": 8,
            "day": 13
          }
        }
      }
    }
  ],
  "relations": [],
  "extensions": {
    "metadata": {
      "datasetId": "specification-exact-supported",
      "title": "Exact supported declarations"
    },
    "draft.github.sukoyaka-dopeness.specification": {
      "specVersion": "0.1.0",
      "uses": [
        {
          "extension": "metadata",
          "version": "1.0.0"
        },
        {
          "extension": "history",
          "version": "1.0.0"
        }
      ]
    }
  }
}
