{
  "version": "1.0",
  "entities": [
    {
      "id": "entity-tokyo-station",
      "name": "Tokyo Station",
      "extensions": {
        "experimental.github.sukoyaka-dopeness.coordinate": {
          "coordinates": [
            {
              "spaceId": "geographic-crs84",
              "values": {
                "longitude": 139.7671,
                "latitude": 35.6812
              }
            }
          ]
        }
      }
    }
  ],
  "events": [],
  "relations": [],
  "extensions": {
    "experimental.github.sukoyaka-dopeness.coordinate": {
      "formatVersion": "0.1.0",
      "spaces": [
        {
          "id": "geographic-crs84",
          "name": "Geographic CRS84",
          "kind": "geographic-2d",
          "externalReference": {
            "authority": "OGC",
            "identifier": "http://www.opengis.net/def/crs/OGC/1.3/CRS84"
          },
          "components": {
            "longitude": {
              "unit": "degree",
              "positiveDirection": "east"
            },
            "latitude": {
              "unit": "degree",
              "positiveDirection": "north"
            }
          }
        }
      ]
    }
  }
}
