{
  "version": "1.0",
  "events": [
    {
      "id": "event-space-age",
      "name": "Space Age begins",
      "description": "A broad historical milestone recorded at year precision.",
      "extensions": {
        "history": {
          "time": {
            "year": 1957
          }
        }
      }
    },
    {
      "id": "event-apollo-program",
      "name": "Apollo program milestone",
      "description": "A program milestone recorded at month precision.",
      "extensions": {
        "history": {
          "time": {
            "year": 1961,
            "month": 5
          }
        }
      }
    },
    {
      "id": "event-apollo-launch",
      "name": "Apollo 11 launch",
      "description": "The mission launch date is recorded at day precision.",
      "extensions": {
        "history": {
          "time": {
            "year": 1969,
            "month": 7,
            "day": 16
          }
        }
      }
    },
    {
      "id": "event-lunar-landing-minute",
      "name": "Apollo 11 lunar landing",
      "description": "The landing time is recorded at minute precision.",
      "extensions": {
        "history": {
          "time": {
            "year": 1969,
            "month": 7,
            "day": 20,
            "hour": 20,
            "minute": 17,
            "timeZone": "Etc/UTC",
            "offset": "+00:00"
          }
        }
      }
    },
    {
      "id": "event-first-step-second",
      "name": "First step on the Moon",
      "description": "The event is recorded at second precision.",
      "extensions": {
        "history": {
          "time": {
            "year": 1969,
            "month": 7,
            "day": 21,
            "hour": 2,
            "minute": 56,
            "second": 15,
            "timeZone": "Etc/UTC",
            "offset": "+00:00"
          }
        }
      }
    }
  ],
  "entities": [],
  "relations": []
}
