{
  "version":"1.0",
  "entities":[
    {"id":"incident-command","name":"地域災害対策本部","description":"地域の緊急対応を調整する合同対策本部。"},
    {"id":"city-hospital","name":"市立総合病院","description":"負傷者と避難者を受け入れる中心病院。"},
    {"id":"fire-service","name":"地域消防救助隊","description":"火災、救助、危険な状況に対応する組織。"},
    {"id":"police-service","name":"地域警察本部","description":"治安、立入管理、避難経路を調整する組織。"},
    {"id":"ambulance-dispatch","name":"救急搬送指令室","description":"救急車の配置と患者搬送を調整する指令室。"},
    {"id":"public-health","name":"保健所","description":"健康案内、感染症対策、住民への情報を調整する機関。"},
    {"id":"shelter-network","name":"緊急避難所ネットワーク","description":"一時避難所を運営し収容状況を把握するネットワーク。"},
    {"id":"utility-operator","name":"地域インフラ運用会社","description":"電気、水道など重要サービスを復旧する事業者。"},
    {"id":"transit-operator","name":"地域交通事業者","description":"緊急輸送と避難のための移動サービスを維持する事業者。"},
    {"id":"volunteer-coordination","name":"ボランティア調整センター","description":"訓練を受けたボランティアを見守りと物流の業務に配置する拠点。"},
    {"id":"weather-office","name":"地域気象台","description":"被災地域の予報と警報を提供する機関。"},
    {"id":"communications-center","name":"緊急通信センター","description":"確認済みの住民向け情報を発信し、対応機関の通信を維持するセンター。"}
  ],
  "events":[
    {"id":"severe-storm","name":"大規模暴風雨警報","description":"大規模な暴風雨が地域を通過する見込みで、緊急調整が始まる。"},
    {"id":"evacuation-order","name":"避難指示","description":"当局が危険地域からの予防的な避難を指示する。"}
  ],
  "relations":[
    {"id":"r01","name":"調整する","sourceId":"incident-command","targetId":"city-hospital"},
    {"id":"r02","name":"調整する","sourceId":"incident-command","targetId":"fire-service"},
    {"id":"r03","name":"調整する","sourceId":"incident-command","targetId":"police-service"},
    {"id":"r04","name":"調整する","sourceId":"incident-command","targetId":"ambulance-dispatch"},
    {"id":"r05","name":"調整する","sourceId":"incident-command","targetId":"public-health"},
    {"id":"r06","name":"調整する","sourceId":"incident-command","targetId":"shelter-network"},
    {"id":"r07","name":"調整する","sourceId":"incident-command","targetId":"utility-operator"},
    {"id":"r08","name":"調整する","sourceId":"incident-command","targetId":"transit-operator"},
    {"id":"r09","name":"調整する","sourceId":"incident-command","targetId":"volunteer-coordination"},
    {"id":"r10","name":"予報を受ける","sourceId":"incident-command","targetId":"weather-office"},
    {"id":"r11","name":"通じて発信する","sourceId":"incident-command","targetId":"communications-center"},
    {"id":"r12","name":"収容力を共有する","sourceId":"city-hospital","targetId":"public-health"},
    {"id":"r13","name":"患者を受け入れる","sourceId":"city-hospital","targetId":"ambulance-dispatch"},
    {"id":"r14","name":"支援を要請する","sourceId":"city-hospital","targetId":"utility-operator"},
    {"id":"r15","name":"病床を調整する","sourceId":"city-hospital","targetId":"shelter-network"},
    {"id":"r16","name":"連携する","sourceId":"fire-service","targetId":"police-service"},
    {"id":"r17","name":"搬送を要請する","sourceId":"fire-service","targetId":"ambulance-dispatch"},
    {"id":"r18","name":"危険を報告する","sourceId":"fire-service","targetId":"utility-operator"},
    {"id":"r19","name":"経路を確保する","sourceId":"fire-service","targetId":"transit-operator"},
    {"id":"r20","name":"通行情報を共有する","sourceId":"police-service","targetId":"ambulance-dispatch"},
    {"id":"r21","name":"経路を確保する","sourceId":"police-service","targetId":"transit-operator"},
    {"id":"r22","name":"確認済み情報を送る","sourceId":"police-service","targetId":"communications-center"},
    {"id":"r23","name":"健康案内を発行する","sourceId":"public-health","targetId":"weather-office"},
    {"id":"r24","name":"支援する","sourceId":"public-health","targetId":"shelter-network"},
    {"id":"r25","name":"案内を発信する","sourceId":"public-health","targetId":"communications-center"},
    {"id":"r26","name":"ボランティアを配置する","sourceId":"shelter-network","targetId":"volunteer-coordination"},
    {"id":"r27","name":"進入を調整する","sourceId":"shelter-network","targetId":"transit-operator"},
    {"id":"r28","name":"サービスを復旧する","sourceId":"utility-operator","targetId":"communications-center"},
    {"id":"r29","name":"警報を受ける","sourceId":"transit-operator","targetId":"weather-office"},
    {"id":"r30","name":"情報を共有する","sourceId":"volunteer-coordination","targetId":"communications-center"},
    {"id":"r31","name":"発動させる","sourceId":"severe-storm","targetId":"incident-command"},
    {"id":"r32","name":"引き起こす","sourceId":"severe-storm","targetId":"weather-office"},
    {"id":"r33","name":"発動させる","sourceId":"evacuation-order","targetId":"incident-command"},
    {"id":"r34","name":"指示する","sourceId":"evacuation-order","targetId":"police-service"},
    {"id":"r35","name":"開設する","sourceId":"evacuation-order","targetId":"shelter-network"},
    {"id":"r36","name":"輸送を必要とする","sourceId":"evacuation-order","targetId":"transit-operator"}
  ],
  "extensions":{"metadata":{"datasetId":"visual-fixture-regional-emergency-response-v1-ja","title":"地域緊急対応"}}
}
