{
  "version": "1.0",
  "entities": [],
  "events": [],
  "relations": [],
  "extensions": {
    "vendor.example.source": {
      "value": true
    },
    "vendor.example.target": {
      "value": true
    },
    "draft.github.sukoyaka-dopeness.specification": {
      "specVersion": "0.1.0",
      "uses": [
        {
          "extension": "vendor.example.source",
          "version": "1.0.0"
        },
        {
          "extension": "vendor.example.target",
          "version": "1.4.0"
        }
      ],
      "definitions": [
        {
          "extension": "vendor.example.source",
          "version": "1.0.0",
          "requires": [
            {
              "target": {
                "extension": "vendor.example.target"
              },
              "range": ">=1.2.0 <2.0.0"
            }
          ]
        }
      ]
    }
  }
}
