{
  "version": "1.0",
  "entities": [],
  "events": [],
  "relations": [],
  "extensions": {
    "metadata": {
      "datasetId": "field-guide-2026",
      "title": "Coastal Field Guide 2026 (hypothetical revision)"
    },
    "draft.github.sukoyaka-dopeness.lineage": {
      "specVersion": "0.1.0",
      "parents": [
        { "kind": "revision", "target": { "datasetId": "field-guide-2025" } }
      ]
    }
  }
}
