{
  "version": "1.0",
  "entities": [],
  "events": [
    {
      "id": "event-position-order",
      "extensions": {
        "history": {
          "assertions": [
            {
              "id": "time-ordered",
              "type": "position",
              "position": {
                "year": 2026,
                "month": 9,
                "day": 18
              },
              "temporalOrder": 20
            }
          ]
        }
      }
    }
  ],
  "relations": [],
  "extensions": {
    "draft.github.sukoyaka-dopeness.specification": {
      "specVersion": "0.1.0",
      "uses": [
        {
          "extension": "history",
          "version": "2.0.0"
        }
      ]
    }
  }
}
