{
  "version": "1.0",
  "entities": [],
  "events": [],
  "relations": [],
  "extensions": {
    "experimental.github.sukoyaka-dopeness.coordinate": {
      "formatVersion": "0.1.0",
      "spaces": []
    },
    "draft.github.sukoyaka-dopeness.coordinate": {
      "specVersion": "0.1.0",
      "spaces": []
    }
  }
}
